{
  "id": "australian-makerspace-directory",
  "name": "Australian Makerspace Directory",
  "scope": "Makerspaces",
  "url": "https://makerspaces.com.au/",
  "description": "Interactive map of makerspaces, hackerspaces, and community workshops. Filter by equipment and features. The most comprehensive maker-only directory."
}
