{
  "id": "wireless-org-au-community-networks",
  "name": "wireless.org.au — Community Networks",
  "scope": "Mesh &amp; Wireless",
  "url": "https://wireless.org.au/community/",
  "description": "Australian community wireless networks — Meshtastic, LoRaWAN, legacy mesh. Groups by state, Discord links. Also covers Meshtastic AU specifically."
}
