{
  "id": "techboard-startup-tech-mapping",
  "name": "Techboard — Startup + Tech Mapping",
  "scope": "Startup Mapping",
  "url": "https://techboard.com.au/techboards-australian-startup-tech-mapping-project/",
  "description": "National startup and tech mapping project. Originally WA-focused, now expanded nationally. VC/growth lens — complements but doesn't overlap commons tech."
}
