{
  "id": "wia-club-directory",
  "name": "WIA — Club Directory",
  "scope": "Radio",
  "url": "https://www.wia.org.au/clubs/",
  "description": "Wireless Institute of Australia (est. 1910) — the world's oldest national amateur radio society. Lists every affiliated club by state. Comprehensive for radio, nothing else."
}
