{
  "id": "civic-tech-field-guide-australia",
  "name": "Civic Tech Field Guide — Australia",
  "scope": "Civic Tech",
  "url": "https://civictech.guide/location/australia/",
  "description": "Part of a global inventory of 8,000+ civic tech projects. Lists tools and organisations (OpenAustralia, Planning Alerts, NationalMap) rather than meetup communities."
}
