{
  "id": "atrium-australian-tech-communities",
  "name": "Atrium — Australian Tech Communities",
  "scope": "Startup Ecosystem",
  "url": "https://www.atrium.me/community",
  "description": "100+ communities, startup hubs, accelerators, co-working spaces, and founder networks. VC/growth-oriented rather than commons."
}
