{
  "id": "meshmap-me-the-mesh-directory",
  "name": "MeshMap.me — The Mesh Directory",
  "scope": "Mesh &amp; Wireless",
  "url": "https://meshmap.me/",
  "description": "Global directory of LoRa mesh organisations, groups, and clubs — Meshtastic, MeshCore, Reticulum, and LoRa radio mesh technology."
}
