{
  "id": "repair-caf-s-amp-fix-it-australia-map",
  "name": "Repair Cafés &amp; Fix-It — Australia Map",
  "scope": "Repair &amp; Reuse",
  "url": "https://www.google.com/maps/d/viewer?mid=1W9mcrEQpDKbALtiOv7aDjcE4eCM",
  "description": "Community-maintained Google Map of 100+ repair events nationally. Drop-in sessions, tool libraries, electronics reuse hubs."
}
