{
  "id": "tech-groups",
  "name": "Tech Groups",
  "scope": "Tech Meetups",
  "url": "https://www.techgroups.org/",
  "description": "Aggregator for tech meetups, conferences, and events across Australian cities. Broad and uncurated — every React meetup and AWS user group alongside everything else."
}
