{
  "id": "linux-australia-lugs",
  "name": "Linux Australia — LUGs",
  "scope": "Open Source",
  "url": "https://linux.org.au/lugs/",
  "description": "Peak body for open-source in Australasia. Lists Linux User Groups by state plus a hackerspaces page linking to the Hackerspaces Wiki and mailing list."
}
