{
  "id": "australian-design-centre-repair-map",
  "name": "Australian Design Centre — Repair Map",
  "scope": "Repair &amp; Reuse",
  "url": "https://australiandesigncentre.com/repair-map/",
  "description": "Sydney-focused repair community map. Shows the vibrant repair ecosystem around Sydney — cafés, mending groups, reuse centres."
}
