{
  "id": "core-electronics-makerspaces",
  "name": "Core Electronics — Makerspaces",
  "scope": "Makerspaces",
  "url": "https://core-electronics.com.au/makerspaces",
  "description": "Community-driven makerspace finder from the Newcastle hardware retailer. Map-based, equipment-focused. Hosts the TTN Newcastle meetup."
}
