{
  "id": "openaustralia-foundation",
  "name": "OpenAustralia Foundation",
  "scope": "Civic Tech",
  "url": "https://oaf.org.au/",
  "description": "Builds free, open-source civic tech — Planning Alerts (198k+ development applications), They Vote For You, Right to Know (FOI requests). Relies on donations."
}
